<?xml version="1.0" encoding="UTF-8"?>
<xs:schema xmlns:xs="http://www.w3.org/2001/XMLSchema">
    <xs:element name="travelSightbase">
        <xs:complexType>
            <xs:sequence>
                <xs:element name="about">
                    <xs:complexType>
                        <xs:sequence>
                            <xs:element ref="title"/>
                            <xs:element name="author"/>
                            <xs:element ref="description"/>
                        </xs:sequence>
                    </xs:complexType>
                </xs:element>
                <xs:element name="sourceDefs">
                    <xs:complexType>
                        <xs:sequence>
                            <xs:element maxOccurs="unbounded" name="sourceDef">
                                <xs:complexType>
                                    <xs:sequence>
                                        <xs:element ref="title"/>
                                        <xs:element ref="description"/>
                                        <xs:element name="url"/>
                                    </xs:sequence>
                                    <xs:attribute ref="id" use="required"/>
                                </xs:complexType>
                            </xs:element>
                        </xs:sequence>
                    </xs:complexType>
                </xs:element>
                <xs:element name="travelSights">
                    <xs:complexType>
                        <xs:sequence>
                            <xs:element name="travelSight" maxOccurs="unbounded">
                                <xs:complexType>
                                    <xs:sequence>
                                        <xs:element ref="title"/>
                                        <xs:element ref="description"/>
                                        <xs:element name="sources">
                                            <xs:complexType>
                                                <xs:sequence>
                                                  <xs:element maxOccurs="unbounded"
                                                  name="sourceRefId" type="xs:IDREF"/>
                                                </xs:sequence>
                                            </xs:complexType>
                                        </xs:element>
                                        <xs:element name="location"/>
                                        <xs:element name="pictures">
                                            <xs:complexType>
                                                <xs:sequence>
                                                  <xs:element maxOccurs="unbounded" name="picture">
                                                  <xs:complexType>
                                                  <xs:attribute name="path" use="required"/>
                                                  </xs:complexType>
                                                  </xs:element>
                                                </xs:sequence>
                                            </xs:complexType>
                                        </xs:element>
                                        <xs:element name="review" maxOccurs="unbounded">
                                            <xs:complexType mixed="true">
                                                <xs:sequence>
                                                  <xs:element name="p" maxOccurs="unbounded"
                                                  minOccurs="0"/>
                                                </xs:sequence>
                                                <xs:attribute ref="id" use="required"/>
                                            </xs:complexType>
                                        </xs:element>
                                        <xs:element name="highLight" maxOccurs="unbounded"> </xs:element>
                                        <xs:element name="thingsToDo">
                                            <xs:complexType>
                                                <xs:sequence>
                                                  <xs:element maxOccurs="unbounded" name="thingToDo">
                                                  <xs:complexType>
                                                  <xs:sequence>
                                                  <xs:element ref="title"/>
                                                  <xs:element minOccurs="0" name="telephone"/>
                                                  <xs:element minOccurs="0" name="address"/>
                                                  <xs:element minOccurs="0" name="gettingThere"/>
                                                  <xs:element minOccurs="0" name="moreInfo"/>
                                                  <xs:element minOccurs="0" name="openHours"/>
                                                  </xs:sequence>
                                                  </xs:complexType>
                                                  </xs:element>
                                                </xs:sequence>
                                            </xs:complexType>
                                        </xs:element>
                                        <xs:element name="associations">
                                            <xs:complexType>
                                                <xs:sequence>
                                                  <xs:element maxOccurs="unbounded" name="siteRefId"
                                                  type="xs:IDREF"/>
                                                </xs:sequence>
                                            </xs:complexType>
                                        </xs:element>
                                    </xs:sequence>
                                    <xs:attribute ref="id" use="required"/>
                                    <xs:attribute name="rank" use="required">
                                        <xs:simpleType>
                                            <xs:restriction base="xs:integer">
                                                <xs:enumeration value="1"/>
                                                <xs:enumeration value="2"/>
                                                <xs:enumeration value="3"/>
                                                <xs:enumeration value="4"/>
                                                <xs:enumeration value="5"/>
                                                <xs:enumeration value="6"/>
                                                <xs:enumeration value="7"/>
                                                <xs:enumeration value="8"/>
                                                <xs:enumeration value="9"/>
                                                <xs:enumeration value="10"/>
                                                <xs:enumeration value="11"/>
                                                <xs:enumeration value="12"/>
                                                <xs:enumeration value="13"/>
                                                <xs:enumeration value="14"/>
                                                <xs:enumeration value="15"/>
                                            </xs:restriction>
                                        </xs:simpleType>
                                    </xs:attribute>
                                    <xs:attribute name="tag" use="required"/>
                                </xs:complexType>
                            </xs:element>
                        </xs:sequence>
                    </xs:complexType>
                </xs:element>
                <xs:element name="locations">
                    <xs:complexType>
                        <xs:sequence>
                            <xs:element ref="location"/>
                        </xs:sequence>
                    </xs:complexType>
                </xs:element>
                <xs:element name="sequence">
                    <xs:complexType>
                        <xs:sequence>
                            <xs:element maxOccurs="unbounded" name="siteRefId" type="xs:IDREF"/>
                        </xs:sequence>
                    </xs:complexType>
                </xs:element>
            </xs:sequence>
        </xs:complexType>
    </xs:element>
    <xs:element name="title"/>
    <xs:element name="description">
        <xs:complexType>
            <xs:group maxOccurs="unbounded" ref="block"/>
        </xs:complexType>
    </xs:element>
    <xs:attribute name="id" type="xs:ID"/>
    <xs:element name="a"/>
    <xs:element name="b"/>
    <xs:element name="i"/>
    <xs:element name="location">
        <xs:complexType>
            <xs:sequence>
                <xs:element ref="title"/>
                <xs:element maxOccurs="unbounded" minOccurs="0" name="siteRefId" type="xs:IDREF"/>
                <xs:element maxOccurs="unbounded" minOccurs="0" ref="location"/>
            </xs:sequence>
            <xs:attribute ref="id" use="required"/>
        </xs:complexType>
    </xs:element>
    <xs:element name="xref">
        <xs:complexType>
            <xs:sequence>
                <xs:element name="xrefText">
                    <xs:complexType mixed="true">
                        <xs:sequence>
                            <xs:element name="hotText"/>
                        </xs:sequence>
                    </xs:complexType>
                </xs:element>
            </xs:sequence>
            <xs:attribute ref="id" use="required"/>
            <xs:attribute name="type" use="required">
                <xs:simpleType>
                    <xs:restriction base="xs:NMTOKEN">
                        <xs:enumeration value="off"/>
                        <xs:enumeration value="web"/>
                        <xs:enumeration value="local"/>
                    </xs:restriction>
                </xs:simpleType>
            </xs:attribute>
            <xs:attribute name="dest" use="required"/>
        </xs:complexType>
    </xs:element>
    <xs:element name="p">
        <xs:complexType mixed="true">
            <xs:group maxOccurs="unbounded" minOccurs="0" ref="inline"/>
        </xs:complexType>
    </xs:element>
    <xs:group name="block">
        <xs:choice>
            <xs:element ref="p"/>
            <xs:element ref="ul"/>
            <xs:element ref="ol"/>
            <xs:element ref="br"/>
            <xs:element ref="table"/>
            <xs:element name="media">
                <xs:complexType>
                    <xs:sequence>
                        <xs:element ref="title"/>
                        <xs:element minOccurs="0" name="caption">
                            <xs:complexType mixed="true">
                                <xs:group ref="inline"/>
                            </xs:complexType>
                        </xs:element>
                    </xs:sequence>
                    <xs:attribute ref="id" use="required"/>
                    <xs:attribute name="url" type="xs:string" use="required"/>
                    <xs:attribute name="type" use="required">
                        <xs:simpleType>
                            <xs:restriction base="xs:NMTOKEN">
                                <xs:enumeration value="imageWeb"/>
                                <xs:enumeration value="imageLocal"/>
                            </xs:restriction>
                        </xs:simpleType>
                    </xs:attribute>
                    <xs:attribute name="style" type="xs:string"/>
                </xs:complexType>
            </xs:element>
            <xs:element ref="editor"/>
        </xs:choice>
    </xs:group>
    <xs:element name="ul">
        <xs:complexType>
            <xs:choice maxOccurs="unbounded">
                <xs:element ref="li"/>
                <xs:element minOccurs="0" ref="ul"/>
            </xs:choice>
        </xs:complexType>
    </xs:element>
    <xs:element name="ol">
        <xs:complexType>
            <xs:sequence maxOccurs="unbounded">
                <xs:element maxOccurs="unbounded" ref="li"/>
                <xs:element minOccurs="0" ref="ol"/>
            </xs:sequence>
        </xs:complexType>
    </xs:element>
    <xs:element fixed="" name="br" nillable="true"/>
    <xs:element name="table">
        <xs:complexType>
            <xs:sequence maxOccurs="unbounded" minOccurs="0">
                <xs:element maxOccurs="unbounded" name="tr">
                    <xs:complexType mixed="false">
                        <xs:sequence>
                            <xs:element maxOccurs="unbounded" name="td">
                                <xs:complexType mixed="true">
                                    <xs:choice maxOccurs="unbounded">
                                        <xs:group ref="block"/>
                                    </xs:choice>
                                    <xs:attribute name="style" type="xs:string" use="optional"/>
                                </xs:complexType>
                            </xs:element>
                        </xs:sequence>
                        <xs:attribute name="style" type="xs:string" use="optional"/>
                    </xs:complexType>
                </xs:element>
            </xs:sequence>
            <xs:attribute name="border" type="xs:string" use="optional"/>
            <xs:attribute name="cellSpacing" type="xs:string" use="optional"/>
            <xs:attribute name="cellPadding" type="xs:string" use="optional"/>
            <xs:attribute name="style" type="xs:string" use="optional"/>
        </xs:complexType>
    </xs:element>
    <xs:element name="editor">
        <xs:complexType mixed="true">
            <xs:attribute name="showEdits" type="xs:boolean"/>
        </xs:complexType>
    </xs:element>
    <xs:group name="inline">
        <xs:choice>
            <xs:element minOccurs="0" ref="b"/>
            <xs:element minOccurs="0" ref="i"/>
            <xs:element minOccurs="0" ref="u"/>
            <xs:element minOccurs="0" ref="xref"/>
            <xs:element minOccurs="0" name="pubMentioned"/>
        </xs:choice>
    </xs:group>
    <xs:element name="u"/>
    <xs:element name="li">
        <xs:complexType mixed="true">
            <xs:group maxOccurs="unbounded" minOccurs="0" ref="inline"/>
        </xs:complexType>
    </xs:element>
</xs:schema>
