<?xml version="1.0" encoding="UTF-8"?>
<travelSightbase xmlns:xsi="http://www.w3.org/2001/XMLSchema-instance"
    xsi:noNamespaceSchemaLocation="travelSight.xsd">
    <about>
        <title>M &amp; T Travel Factory</title>
        <author>Meg Wang</author>
        <description>
            <p>Why we travel</p>
                <p>For us, travelling is one of our favorite hobbies. It is a time to relax and enjoy our stay in a environment different to what we have back at home. Travelling allows us to meet new people, new adventures, new food and new experiences. We travel to see what the world is like beyond our living room, classrooms and reading rooms.</p>                
                <p>We travel so we can lose ourselves in a world that we are trying to understand and find ourselves at the same time. Through travelling, we learn to open our eyes and immerse ourselves in a world that we have only seen through pictures and movies. We spend our money travelling but get richer in the process.</p>
            <p>By T</p>
            <ul>
                <li>NO.1 Maldives</li>
                <li>NO.2 Paris</li>
                <li>NO.3 Venice</li>
                <li>NO.4 Helsinki</li>
                <li>NO.5 Taiwan</li>
                <li>NO.6 Greece</li>
                <li>NO.7 Sydney</li>
                <li>NO.8 Cuba</li>
                <li>NO.9 Barcelona</li>
                <li>NO.10 London</li>
                <li>NO.11 Maui</li>
                <li>NO.12 Prague</li>
                <li>NO.13 Vancouver</li>
                <li>NO.14 Budapest</li>
                <li>NO.15 Hong Kong</li>
            </ul>
        </description>
    </about>

    <sourceDefs>
        <sourceDef id="s01">
            <title>visitMaldives</title>
            <description>
                <p>official website</p>
            </description>
            <url>http://www.visitmaldives.com/en</url>
        </sourceDef>
        <sourceDef id="s02">
            <title>gogobot</title>
            <description>
                <p>official website</p>
            </description>
            <url>www.gogobot.com</url>
        </sourceDef>
        <sourceDef id="s03">
            <title>Lonely Planet</title>
            <description>
                <p>official website</p>
            </description>
            <url>www.lonelyplanet.com/france</url>
        </sourceDef>
        <sourceDef id="s04">
            <title>Lonely Planet</title>
            <description>
                <p>official website</p>
            </description>
            <url>www.lonelyplanet.com/helsinki</url>
        </sourceDef>
        <sourceDef id="s05">
            <title>Lonely Planet</title>
            <description>
                <p>official website</p>
            </description>
            <url>www.lonelyplanet.com/</url>
        </sourceDef>
        <sourceDef id="s06">
            <title>Lonely Planet</title>
            <description>
                <p>official website</p>
            </description>
            <url>www.lonelyplanet.com/greece</url>
        </sourceDef>
        <sourceDef id="s07">
            <title>Lonely Planet</title>
            <description>
                <p>official website</p>
            </description>
            <url>www.lonelyplanet.com/australia</url>
        </sourceDef>
        <sourceDef id="s08">
            <title>Lonely Planet</title>
            <description>
                <p>official website</p>
            </description>
            <url>www.lonelyplanet.com/cuba</url>
        </sourceDef>
        <sourceDef id="s09">
            <title>Lonely Planet</title>
            <description>
                <p>official website</p>
            </description>
            <url>www.lonelyplanet.com/barcelona</url>
        </sourceDef>
        <sourceDef id="s10">
            <title>Lonely Planet</title>
            <description>
                <p>official website</p>
            </description>
            <url>www.lonelyplanet.com/london</url>
        </sourceDef>
        <sourceDef id="s11">
            <title>Lonely Planet</title>
            <description>
                <p>official website</p>
            </description>
            <url>www.lonelyplanet.com/</url>
        </sourceDef>
        <sourceDef id="s12">
            <title>Lonely Planet</title>
            <description>
                <p>official website</p>
            </description>
            <url>www.lonelyplanet.com/prague</url>
        </sourceDef>
        <sourceDef id="s13">
            <title>Lonely Planet</title>
            <description>
                <p>official website</p>
            </description>
            <url>www.lonelyplanet.com/vancouver</url>
        </sourceDef>
        <sourceDef id="s14">
            <title>Lonely Planet</title>
            <description>
                <p>official website</p>
            </description>
            <url>www.lonelyplanet.com/budapest</url>
        </sourceDef>
        <sourceDef id="s15">
            <title>Lonely Planet</title>
            <description>
                <p>official website</p>
            </description>
            <url>www.lonelyplanet.com/hongkong</url>
        </sourceDef>
    </sourceDefs>

    <travelSights>
        <travelSight id="site1" rank="1" tag="natural sight, diving, fishing, beach">
            <title>Maldives</title>
            <description>                
                <p><b>Welcome to the <u>Maldives!</u></b></p>
                <ul>
                    <li>Where <i>sands</i> are white as the smiles of the locals</li>
                    <li>Where <i>fish</i> swim happily in the warm waters of the Indian Ocean</li>
                    <li>Where the <i>weather</i> is a dream, and the deep rays of the sun waits to engulf
                        you in their arms</li>
                </ul>
                <p>For more information, please look into <pubMentioned>"Lonely Planet"</pubMentioned> 
                    <xref id="x01" type="web" dest="http://www.lonelyplanet.com/search?q=maldives">
                    <xrefText> (<hotText>http://www.lonelyplanet.com/search?q=maldives</hotText>) </xrefText>
                </xref>
                </p>
            </description>
            <sources>
                <sourceRefId>s01</sourceRefId>
                <sourceRefId>s02</sourceRefId>
            </sources>
            <location country="Republic of Maldives"/>
            <pictures>
                <picture path="maldives1.jpg"/>
            </pictures>
            <review id="r1">
                <p><b>Jelly</b>: What an amazing place. Be sure to be at the summit before the
                    sunrise. It's like seeing a sci-fi movie come to life. Recommended for: Outdoor
                    Enthusiasts</p>
            </review>
            <review id="r16">
                <p><b>Young</b>: Must see sunrise place. Worth the time to go there, be ready for
                    the cold though. Pack up some warm clothes. Recommended for: Backpackers History
                    Buffs Adventure Travelers</p>
            </review>
            <highLight>
                <p>The Maldives is the perfect destination for the most ardent of divers or for the
                    first time snorkeller with a huge range of marine biodiversity and exceptional
                    visibility </p>
             </highLight>
            <highLight>
                <p>You won't find a single echoey corridor anywhere in the Maldives</p>
            </highLight>


            <thingsToDo>
                <thingToDo>
                    <title>Outdoor Sports</title>
                    <telephone>206-777-7777</telephone>
                </thingToDo>
                <thingToDo>
                    <title>Fish Market</title>
                    <address>Boduthankurufaanu Magu, Malé, Maldives </address>
                </thingToDo>
                <thingToDo>
                    <title>National Museum</title>
                    <address>Chandhanee Magu, Malé, Maldives</address>
                    <openHours>10am-5pm Sun-Thu</openHours>
                </thingToDo>
            </thingsToDo>
            <associations>
                <siteRefId>site5</siteRefId>
                <siteRefId>site8</siteRefId>
                <siteRefId>site11</siteRefId>
            </associations>
        </travelSight>

        <travelSight id="site2" rank="2" tag="Romantic, Historical, Literatural">
            <title>Paris</title>
            <description>
                <p> France seduces travellers with its unfalteringly familiar culture, woven around
                    cafe terraces, village-square markets and lace-curtained bistros with their plat
                    du jour chalked on the board. </p>
            </description>
            <sources>
                <sourceRefId>s03</sourceRefId>
            </sources>
            <location country="France"/>
            <pictures>
                <picture path="paris1.jpg"/>
            </pictures>

            <review id="r2">
                <p> France has been home for two decades yet I can’t shake off that uncanny feeling
                    I’m on holiday – French art de vivre (art of living) is just too good and I’m
                    mad about it. From my Haute-Savoie house on Lake Geneva’s southern shore, the
                    dark green hills of the Jura and un café in the wisteria-draped village bar are
                    my wake-up call. Weekends of endless possibilities punctuate the gentle rhythm
                    of village life: ravishing art museums in Lyon and Paris, hiking and skiing in
                    the Alps, paddle boarding on the glittering lake, road trips to Beaujolais and
                    Burgundy and other regions so different they could be another country. France’s
                    sheer variety never ceases to amaze me. </p>
            </review>


            <highLight>